[
  {
    "id": "text-action-001",
    "capability": "semantic.extract",
    "sourceType": "text",
    "sourcePath": "corpus/action-001.txt",
    "sourceHash": "ff3b2852c3d4c77f2ae15992f2753786f04bdcb5e547cd42df7c8f37e0d830dc",
    "license": "Repository LICENSE (GNU GPL version 3)",
    "referenceOutputPath": "references/action-001.json",
    "measurementMethod": "Exact candidate-key set comparison, partitioned by SemanticCandidateKind; no processor execution.",
    "measurementDate": "2026-09-08",
    "hostileInjection": false,
    "notes": "Synthetic text fixture; no user or external media content."
  },
  {
    "id": "text-decision-001",
    "capability": "semantic.extract",
    "sourceType": "text",
    "sourcePath": "corpus/decision-001.txt",
    "sourceHash": "bb3392501018aa4b52377c12d76b517546aa714269d07f0c1209f463862ff502",
    "license": "Repository LICENSE (GNU GPL version 3)",
    "referenceOutputPath": "references/decision-001.json",
    "measurementMethod": "Exact candidate-key set comparison, partitioned by SemanticCandidateKind; no processor execution.",
    "measurementDate": "2026-09-08",
    "hostileInjection": false,
    "notes": "Synthetic text fixture; no user or external media content."
  },
  {
    "id": "text-question-001",
    "capability": "semantic.extract",
    "sourceType": "text",
    "sourcePath": "corpus/question-001.txt",
    "sourceHash": "0a89db48859c041d214787e024a3dbe26fb244ecdc776079e303388fcfe06ff7",
    "license": "Repository LICENSE (GNU GPL version 3)",
    "referenceOutputPath": "references/question-001.json",
    "measurementMethod": "Exact candidate-key set comparison, partitioned by SemanticCandidateKind; no processor execution.",
    "measurementDate": "2026-09-08",
    "hostileInjection": false,
    "notes": "Synthetic text fixture; no user or external media content."
  },
  {
    "id": "text-risk-001",
    "capability": "semantic.extract",
    "sourceType": "text",
    "sourcePath": "corpus/risk-001.txt",
    "sourceHash": "f54438683e928ae53be7ec798ae29a42dac3840d68af7136a5177989250eaaca",
    "license": "Repository LICENSE (GNU GPL version 3)",
    "referenceOutputPath": "references/risk-001.json",
    "measurementMethod": "Exact candidate-key set comparison, partitioned by SemanticCandidateKind; no processor execution.",
    "measurementDate": "2026-09-08",
    "hostileInjection": false,
    "notes": "Synthetic text fixture; no user or external media content."
  },
  {
    "id": "text-fact-001",
    "capability": "semantic.extract",
    "sourceType": "text",
    "sourcePath": "corpus/fact-001.txt",
    "sourceHash": "5b6a609fa976bdd6ad2bee61a9b4ddcd365c16becb1892ff2c5ed7b7205fc2c6",
    "license": "Repository LICENSE (GNU GPL version 3)",
    "referenceOutputPath": "references/fact-001.json",
    "measurementMethod": "Exact candidate-key set comparison, partitioned by SemanticCandidateKind; no processor execution.",
    "measurementDate": "2026-09-08",
    "hostileInjection": false,
    "notes": "Synthetic text fixture; no user or external media content."
  },
  {
    "id": "text-reference-001",
    "capability": "semantic.extract",
    "sourceType": "text",
    "sourcePath": "corpus/reference-001.txt",
    "sourceHash": "8a631226e1cf010cc82b17287b3981501f50954728a2a90ae782d10b7659b477",
    "license": "Repository LICENSE (GNU GPL version 3)",
    "referenceOutputPath": "references/reference-001.json",
    "measurementMethod": "Exact candidate-key set comparison, partitioned by SemanticCandidateKind; no processor execution.",
    "measurementDate": "2026-09-08",
    "hostileInjection": false,
    "notes": "Synthetic text fixture; no user or external media content."
  },
  {
    "id": "transcript-001",
    "capability": "semantic.extract",
    "sourceType": "transcript",
    "sourcePath": "corpus/transcript-001.txt",
    "sourceHash": "4003facf9ae68fab3f66f5ceda68940dcce0f7e43a2ef9f91c7c76c8f5d161ac",
    "license": "Repository LICENSE (GNU GPL version 3)",
    "referenceOutputPath": "references/transcript-001.json",
    "measurementMethod": "Exact candidate-key set comparison, partitioned by SemanticCandidateKind; no processor execution.",
    "measurementDate": "2026-09-08",
    "hostileInjection": false,
    "notes": "Synthetic two-speaker transcript; no user or external media content."
  },
  {
    "id": "text-negative-001",
    "capability": "semantic.extract",
    "sourceType": "text",
    "sourcePath": "corpus/negative-001.txt",
    "sourceHash": "f494d5d874b4ba9a16fa928d287e5aa8aae7d95694c953cf68d5956c399dbc1b",
    "license": "Repository LICENSE (GNU GPL version 3)",
    "referenceOutputPath": "references/negative-001.json",
    "measurementMethod": "Exact candidate-key set comparison, partitioned by SemanticCandidateKind; no processor execution.",
    "measurementDate": "2026-09-08",
    "hostileInjection": false,
    "notes": "Negative no-candidate control; synthetic text only."
  },
  {
    "id": "transcript-hostile-001",
    "capability": "semantic.extract",
    "sourceType": "transcript",
    "sourcePath": "corpus/hostile-001.txt",
    "sourceHash": "ffc79ba0938ed2ad9000a1dbac3d29bd11610551e9a01f8e87a62e01a6da90b2",
    "license": "Repository LICENSE (GNU GPL version 3)",
    "referenceOutputPath": "references/hostile-001.json",
    "measurementMethod": "Exact candidate-key set comparison, partitioned by SemanticCandidateKind; no processor execution.",
    "measurementDate": "2026-09-08",
    "hostileInjection": true,
    "notes": "Synthetic hostile-injection transcript; instruction-like text is untrusted data and has no expected candidate."
  }
]
